{
  "$ref": "#/definitions/authors",
  "definitions": {
    "authors": {
      "type": "object",
      "properties": {
        "name": {
          "type": "string"
        },
        "img": {
          "type": "string"
        },
        "bio": {
          "type": "string"
        },
        "designation": {
          "type": "string"
        },
        "twitter": {
          "type": "string"
        },
        "linkedin": {
          "type": "string"
        },
        "$schema": {
          "type": "string"
        }
      },
      "required": [
        "name",
        "img"
      ],
      "additionalProperties": false
    }
  },
  "$schema": "http://json-schema.org/draft-07/schema#"
}