{
  "name": "Soniya",
  "img": "/assets/testimonial/Soniya.webp",
  "bio": "Soniya is a digital marketing strategist with 5+ years of experience. She specializes in SEO and content driven marketing. She is passionate about enhancing brand visibility. She specializes in social media marketing and content creation.",
  "designation": "Marketing Strategist",
  "twitter": "https://x.com/SoniyaDixit21",
  "linkedin": "https://www.linkedin.com/in/dixit-soniya/"
}
