{
  "name": "Pravin",
  "img": "/assets/testimonial/Pravin.png",
  "bio": "Pravin is our CEO and Co-Founder with decades of experience in the tech industry. He is dedicated to driving innovation and excellence in all our projects. He is passionate about leading teams to success.",
  "designation": "CEO & Co-Founder",
  "twitter": "https://twitter.com/pravinkamble",
  "linkedin": "https://www.linkedin.com/in/pravinkamble/"
}
