{
  "name": "Piyush",
  "img": "/assets/testimonial/Piyush.webp",
  "bio": "Piyush is a digital marketing strategist with 5+ years of experience. He specializes in AI-driven marketing solutions. He is passionate about helping businesses grow online. He specializes in copeptive analysis and GEO.",
  "designation": "Marketing Strategist",
  "twitter": "https://twitter.com/PiyushSingh",
  "linkedin": "https://www.linkedin.com/in/piyush-singh-275632222/"
}
