{
  "name": "Mrudul",
  "img": "/assets/testimonial/Mrudul.png",
  "bio": "Mrudul is our CTO with 10+ years of experience in tech. He leads our development team. He is passionate about building scalable solutions. He is an advocate for clean code and best practices.",
  "designation": "CTO & Co-Founder",
  "twitter": "https://twitter.com/mrudult",
  "linkedin": "https://www.linkedin.com/in/mrudult/"
}
